{
  "schema_version": "experiment-manifest/v1alpha",
  "experiment_id": "s3-02-harness-integrity-smoke",
  "issue": 88,
  "purpose": "Verify real synthetic fixture bytes, provenance and artifact bundle integrity.",
  "capability": "harness_integrity",
  "profile_ref": "profiles/payable_document_pt_br/v1alpha/profile.json",
  "dataset_manifest_ref": "datasets/payable_document_pt_br/v1alpha/manifest.json",
  "acceptance_policy_ref": "benchmarks/payable_document_pt_br/v1alpha/acceptance.json",
  "dependency_lock_ref": "tools/experiment_harness/uv.lock",
  "dataset_classification": "synthetic",
  "candidate": {
    "id": "integrity_probe/v1",
    "configuration": {
      "verify_ground_truth": true
    }
  },
  "controls": {
    "runtime_egress_allowed": false,
    "real_data_allowed": false,
    "max_parallel_jobs": 1,
    "timeout_seconds": 120,
    "random_seed": 20260731
  },
  "fixture_selector": {
    "splits": ["development", "validation", "test"],
    "fixture_ids": [
      "dev-inv001-native",
      "dev-inv001-scan",
      "val-slip001-native",
      "val-slip001-scan",
      "dev-rec001-native",
      "dev-rec001-scan",
      "test-inv002-native",
      "test-inv002-scan",
      "dev-slip002-native",
      "test-rec002-native",
      "test-slip003-scan",
      "dev-rec003-scan",
      "val-inv003-png",
      "dev-slip004-jpeg-deg",
      "dev-rec004-png-r090",
      "test-other001-jpeg",
      "val-rec005-hybrid",
      "dev-other002-hybrid",
      "dev-inv001-duplicate",
      "dev-encrypted-pdf",
      "test-corrupt-pdf",
      "dev-mime-mismatch",
      "dev-unsupported-tiff",
      "val-resource-limit",
      "dev-val-missing-field",
      "dev-val-date-conflict",
      "dev-val-invalid-amount",
      "dev-val-invalid-taxid"
    ],
    "expected_fixture_count": 28
  }
}
